"","title","project_lead","ODISSEI_grant","publication","data","link_data","code","programming.language"
"1","The wage penalty for informal caregivers from a life course perspective","<a href=""https://orcid.org/0000-0002-9326-8246"">Klara Raiber</a>","LISS Grant 2019","<a href=""https://doi.org/10.1016/j.alcr.2022.100490"">Journal article</a>","LISS panel data","<a href=""https://doi.org/10.17026/dans-xyf-v7vu"">data</a>","<a href=""https://github.com/social-scientist/Replication-package-Raiber-Visser-and-Verbakel-2022-Advances-in-life-course-research"">link</a>","Stata"
"2","Are the gender gaps in informal caregiving intensity and burden closing due to the COVID-19 pandemic? Evidence from the Netherlands","<a href=""https://orcid.org/0000-0002-9326-8246"">Klara Raiber</a>","LISS Grant 2019","<a href=""https://doi.org/10.1111/gwao.12725"">Journal article</a>","LISS panel data","<a href=""https://doi.org/10.17026/dans-xyf-v7vu"">data</a>; 
<a href=""https://doi.org/10.17026/dans-z6w-rd24"">data</a>","<a href=""https://github.com/social-scientist/Are-the-Gender-Gaps-in-Informal-Caregiving-Intensity-and-Burden-Closing-due-to-the-COVID-19-Pandemic"">link</a>","Stata"
"3","Hours and income dynamics during the Covid-19 pandemic: The case of the Netherlands","<a href=""https://orcid.org/0000-0001-8519-9781"">Hans-Martin von Gaudecker</a>","","<a href=""https://doi.org/10.1016/j.labeco.2021.102055"">Journal article</a>","LISS panel data","<a href=""https://doi.org/10.17026/dans-zva-nzcq"">data</a>","<a href=""https://github.com/ChristianZimpelmann/replication-work-hours-covid/tree/main"">link</a>","Python"
"4","Those were the what? Contents of nostalgia, relative deprivation and radical right support","<a href=""https://orcid.org/0000-0002-8562-5442"">Peter Luca Versteegen</a>","","<a href=""https://doi.org/10.1111/1475-6765.12593"">Journal article</a>","LISS panel data","","<a href=""https://osf.io/jmsu3/"">link</a>","R"
"5","The prospective associations between financial scarcity and financial avoidance","<a href=""https://orcid.org/0000-0002-4366-9332"">Leon Paul Hilbert</a>","LISS Grant 2019","<a href=""https://doi.org/10.1016/j.joep.2021.102459"">Journal article</a>","LISS panel data","<a href=""https://doi.org/10.17026/dans-zha-j8yv"">data</a>","<a href=""https://doi.org/10.17605/OSF.IO/ZMH5N"">link</a>","R"
